Day,Weekday,Time,Pillar,Asset,Caption,Hashtags,AI_Label
17,Wed,5:00 PM,Data,data-market-30b.png,"The US medspa market is compounding ~11% a year toward $30B by 2030.

A fragmented, fast-growing category, which is exactly why the capital is showing up. The winners convert the traffic they already have. → aiclearpath.com/mirror",#medspaowner #medspabusiness #medspamarketing #practicegrowth #aestheticpractice #aestheticbusiness #medspa #aesthetics #aestheticclinic #medspalife #aestheticmedicine #mirrorbyclearpath #selfcare #glowup,no
18,Thu,9:00 AM,Product,product-derm-funnel.png,"The derm consult now starts on your website, long before the appointment.

95% of patients research online first. Mirror lets them preview their result right there, and captures the lead at peak interest instead of after they've clicked away. → aiclearpath.com/mirror",#dermatology #cosmeticdermatology #medspamarketing #patientexperience #aestheticpractice #aesthetictech #beautytech #medspa #aesthetics #aestheticclinic #medspalife #aestheticmedicine #mirrorbyclearpath #selfcare #glowup,no
18,Thu,12:00 PM,BeforeAfter,ba2-18.png,"The fear was never aging. It's looking “done.” That one worry kills more rejuvenation consults than price ever will. So answer it up front: a refreshed version that's unmistakably still her, shown before she commits. (AI simulation, synthetic model.) A nervous maybe becomes a yes. → aiclearpath.com/mirror",#medspamarketing #aesthetics #medspaowner #aestheticpractice #beforeandafter #aesthetictech #injector #patientexperience #aestheticmedicine #medspa #aestheticclinic #medspalife #mirrorbyclearpath #selfcare #glowup,no
18,Thu,5:00 PM,Education,dosage-lip.png,"A natural lip is usually 0.5–1cc, not a full syringe at once.

Building gradually keeps it balanced, and a patient who can see each step trusts the plan.

Save this for your next lip consult.",#lipfiller #dermalfiller #injector #aestheticnurse #aestheticeducation #botoxtips #medspa #aesthetics #aestheticclinic #medspalife #aestheticmedicine #mirrorbyclearpath #selfcare #glowup,no
19,Fri,9:00 AM,Data,data-tourism.png,"An estimated $8.7B in aesthetic spend leaves the US each year for cheaper markets abroad.

The fix isn't lower prices, it's helping price-sensitive patients picture their result at home, then book. → aiclearpath.com/mirror",#medspaowner #medspamarketing #aesthetics #medspabusiness #practicegrowth #aestheticbusiness #medspa #aestheticclinic #medspalife #aestheticmedicine #mirrorbyclearpath #selfcare #glowup,no
19,Fri,12:00 PM,BeforeAfter,ba2-19.png,"A patient who can't picture “clearer skin” doesn't say no. She says “let me think about it,” then books where she can actually see it. That's a $400 visit out the door, and it happens a dozen times a month. Mirror shows her own result on your site in 30 seconds, before she clicks away. (AI simulation, synthetic model.) The ones who see it are the ones who book. → aiclearpath.com/mirror",#medspamarketing #aesthetics #medspaowner #aestheticpractice #beforeandafter #aesthetictech #injector #patientexperience #aestheticmedicine #medspa #aestheticclinic #medspalife #mirrorbyclearpath #selfcare #glowup,no
19,Fri,5:00 PM,Education,education-timeline.png,"“When will I see my Botox?”, about 2 weeks to settle, then 3–4 months of smoothness.

Setting that timeline at the consult prevents the “is it working?” call later. Save this for your team.",#botox #aestheticnurse #injector #medspa #aestheticeducation #botoxtips #aesthetics #aestheticclinic #medspalife #aestheticmedicine #mirrorbyclearpath #selfcare #glowup,no
20,Sat,9:00 AM,Data,data-vectra.png,"In-office 3D imaging hardware runs $10,000+ for a derm practice.

It's powerful in the consult room, but it can't reach the patient still on your website deciding whether to call. Mirror is that web layer, at a fraction of the cost. → aiclearpath.com/mirror",#dermatology #cosmeticdermatology #aesthetics #aesthetictech #medspamarketing #medspaowner #practicegrowth #aestheticbusiness #medspa #aestheticclinic #medspalife #aestheticmedicine #mirrorbyclearpath #selfcare #glowup,no
20,Sat,12:00 PM,BeforeAfter,ba2-20.png,"A patient who can't picture “clearer skin” doesn't say no. She says “let me think about it,” then books where she can actually see it. That's a $400 visit out the door, and it happens a dozen times a month. Mirror shows her own result on your site in 30 seconds, before she clicks away. (AI simulation, synthetic model.) The ones who see it are the ones who book. → aiclearpath.com/mirror",#medspamarketing #aesthetics #medspaowner #aestheticpractice #beforeandafter #aesthetictech #injector #patientexperience #aestheticmedicine #medspa #aestheticclinic #medspalife #mirrorbyclearpath #selfcare #glowup,no
20,Sat,5:00 PM,Education,myth-realism.png,"“AI can't show a realistic result.”

Fair, so we built Mirror to be conservative on purpose. It's a calibrated preview, not a fantasy. Don't take our word for it: judge the realism yourself in the live demo. → aiclearpath.com/mirror",#aesthetictech #medspamarketing #ai #aesthetics #medspaowner #aestheticnurse #injector #aestheticeducation #botoxtips #medspa #aestheticclinic #medspalife #aestheticmedicine #mirrorbyclearpath #selfcare,no
21,Sun,9:00 AM,Data,data-derm-barriers.png,"What actually stops a cosmetic-derm patient from booking?

Cost is the #1 barrier (24%), but underneath it is one question: “will it be worth it for me?” Seeing the result first is what answers it. → aiclearpath.com/mirror",#dermatology #cosmeticdermatology #aesthetics #skincare #medspamarketing #medspaowner #practicegrowth #aestheticbusiness #medspa #aestheticclinic #medspalife #aestheticmedicine #mirrorbyclearpath #selfcare #glowup,no
21,Sun,12:00 PM,BeforeAfter,ba2-01.png,"A patient who can't picture “clearer skin” doesn't say no. She says “let me think about it,” then books where she can actually see it. That's a $400 visit out the door, and it happens a dozen times a month. Mirror shows her own result on your site in 30 seconds, before she clicks away. (AI simulation, synthetic model.) The ones who see it are the ones who book. → aiclearpath.com/mirror",#medspamarketing #aesthetics #medspaowner #aestheticpractice #beforeandafter #aesthetictech #injector #patientexperience #aestheticmedicine #medspa #aestheticclinic #medspalife #mirrorbyclearpath #selfcare #glowup,no
21,Sun,5:00 PM,Education,myth-frozen.png,"“AI makes everyone look frozen.”

Not how Mirror works, same face, same expression, just the projected result. Natural is the default. See for yourself in the demo. → aiclearpath.com/mirror",#aesthetictech #medspamarketing #ai #aesthetics #medspaowner #aestheticnurse #injector #aestheticeducation #botoxtips #medspa #aestheticclinic #medspalife #aestheticmedicine #mirrorbyclearpath #selfcare,no
