Day,Weekday,Time,Pillar,Asset,Caption,Hashtags,AI_Label
1,Mon,9:00 AM,Data,data-galleries.png,"Your patients decide with their eyes.

70% choose based on before/after galleries, and 3 in 4 won't even consider a practice without one. If they can't see it, they book elsewhere.

Mirror lets them see their own result, on your site. → aiclearpath.com/mirror",#medspamarketing #aesthetics #medspaowner #patientexperience #beforeandafter #practicegrowth #aestheticbusiness #medspa #aestheticclinic #medspalife #aestheticmedicine #mirrorbyclearpath #selfcare #glowup,no
1,Mon,12:00 PM,BeforeAfter,ba2-01.png,"A patient who can't picture “clearer skin” doesn't say no. She says “let me think about it,” then books where she can actually see it. That's a $400 visit out the door, and it happens a dozen times a month. Mirror shows her own result on your site in 30 seconds, before she clicks away. (AI simulation, synthetic model.) The ones who see it are the ones who book. → aiclearpath.com/mirror",#medspamarketing #aesthetics #medspaowner #aestheticpractice #beforeandafter #aesthetictech #injector #patientexperience #aestheticmedicine #medspa #aestheticclinic #medspalife #mirrorbyclearpath #selfcare #glowup,no
1,Mon,5:00 PM,Product,product-3step.png,"One selfie. Their result. On your site.

Your patient uploads a photo, moves the intensity slider, and sees their own projected result, then books, right there. [AI simulation]

→ aiclearpath.com/mirror",#aesthetictech #medspamarketing #medspaowner #patientexperience #aestheticpractice #beautytech #medspa #aesthetics #aestheticclinic #medspalife #aestheticmedicine #mirrorbyclearpath #selfcare #glowup,no
2,Tue,9:00 AM,Brand,brand-see-yourself.png,"See yourself, after.

Mirror is AI before/after for medspas, dentists & dermatologists, so your patients can picture their result before they book.

Follow along, we're just getting started. → aiclearpath.com/mirror",#medspamarketing #aesthetics #medspaowner #aestheticpractice #beforeandafter #seeyourselfafter #aestheticbusiness #medspa #aestheticclinic #medspalife #aestheticmedicine #mirrorbyclearpath #selfcare #glowup,no
2,Tue,12:00 PM,BeforeAfter,ba2-02.png,"“You look tired” is the most common thing your patients hear, and the treatment they're most likely to put off. The reason is simple: they can't picture the rested version of their own face. So show them before the consult, not after. (AI simulation, synthetic model.) “Maybe someday” turns into a booking this week. → aiclearpath.com/mirror",#medspamarketing #aesthetics #medspaowner #aestheticpractice #beforeandafter #aesthetictech #injector #patientexperience #aestheticmedicine #medspa #aestheticclinic #medspalife #mirrorbyclearpath #selfcare #glowup,no
2,Tue,5:00 PM,Education,education-invisalign.png,"Aligner cases don't start when the patient understands the plan, they start when the patient sees the finish.

“Here's your after” closes the case that “trust me, it'll look great” can't. → aiclearpath.com/mirror",#cosmeticdentistry #invisalign #dentalmarketing #caseacceptance #orthodontics #aestheticnurse #injector #aestheticeducation #botoxtips #medspa #aesthetics #aestheticclinic #medspalife #aestheticmedicine #mirrorbyclearpath,no
3,Wed,9:00 AM,Trust,trust-photo-nowhere.png,"“Where does my photo go?”, the #1 question patients ask about an AI tool.

Our answer: nowhere. Processed in ~20 seconds, then discarded. Never stored, never used to train models, no medical data collected.

Trust is the product. → aiclearpath.com/mirror",#patienttrust #dataprivacy #aesthetics #medspamarketing #medspaowner #aestheticpractice #transparency #medspa #aestheticclinic #medspalife #aestheticmedicine #mirrorbyclearpath #selfcare #glowup,no
3,Wed,12:00 PM,BeforeAfter,ba2-03.png,"Almost 1 in 6 adults calls their own smile “ugly.” They will never say that to you. They just research quietly, hesitate, and book nothing. Here's what flips it: letting them see their brighter smile before the chair. (AI simulation, synthetic model.) → aiclearpath.com/mirror",#medspamarketing #aesthetics #medspaowner #aestheticpractice #beforeandafter #aesthetictech #injector #patientexperience #aestheticmedicine #medspa #aestheticclinic #medspalife #mirrorbyclearpath #selfcare #glowup,no
3,Wed,5:00 PM,Offer,offer-347.png,"No catch. $347/mo, no setup fee.

Installs on your site in ~24 hours, works on anything. And if it doesn't help create 3+ qualified consults in 8 weeks, your money back.

Try the live demo → aiclearpath.com/mirror",#medspaowner #medspabusiness #medspamarketing #aestheticpractice #practicegrowth #aestheticbusiness #medspa #aesthetics #aestheticclinic #medspalife #aestheticmedicine #mirrorbyclearpath #selfcare #glowup,no
4,Thu,9:00 AM,Magnet,magnet-atlas-pe.png,"Free: who's actually buying medspas?

56 PE deals across 20 years, every buyer, sponsor, state and multiple, in one interactive Atlas. No gate.

Explore it (link in bio) → aiclearpath.com/mirror",#medspaowner #medspabusiness #privateequity #medspadata #medspamarketing #freetool #aestheticbusiness #medspa #aesthetics #aestheticclinic #medspalife #aestheticmedicine #mirrorbyclearpath #selfcare #glowup,no
4,Thu,12:00 PM,BeforeAfter,ba2-04.png,"A patient who can't picture “clearer skin” doesn't say no. She says “let me think about it,” then books where she can actually see it. That's a $400 visit out the door, and it happens a dozen times a month. Mirror shows her own result on your site in 30 seconds, before she clicks away. (AI simulation, synthetic model.) The ones who see it are the ones who book. → aiclearpath.com/mirror",#medspamarketing #aesthetics #medspaowner #aestheticpractice #beforeandafter #aesthetictech #injector #patientexperience #aestheticmedicine #medspa #aestheticclinic #medspalife #mirrorbyclearpath #selfcare #glowup,no
4,Thu,5:00 PM,Data,data-pe-worth.png,"Your medspa is worth more than you think.

We tracked 56 verified PE-backed medspa deals since 2006, 23 in 2024 alone. Institutional money decided medspas are a roll-up, and the exit window is open.

We mapped every deal in the MedSpa Atlas. → aiclearpath.com/mirror",#medspaowner #medspabusiness #privateequity #medspamarketing #practicegrowth #aestheticbusiness #medspa #aesthetics #aestheticclinic #medspalife #aestheticmedicine #mirrorbyclearpath #selfcare #glowup,no
5,Fri,9:00 AM,Product,product-slider.png,"The slider your patients move.

Light, medium, or dramatic, they explore the dose themselves and arrive at the consult already sold on the right plan. [AI simulation]

→ aiclearpath.com/mirror",#aesthetictech #medspamarketing #injector #medspaowner #aesthetics #patientexperience #beautytech #medspa #aestheticclinic #medspalife #aestheticmedicine #mirrorbyclearpath #selfcare #glowup,no
5,Fri,12:00 PM,BeforeAfter,ba2-05.png,"“You look tired” is the most common thing your patients hear, and the treatment they're most likely to put off. The reason is simple: they can't picture the rested version of their own face. So show them before the consult, not after. (AI simulation, synthetic model.) “Maybe someday” turns into a booking this week. → aiclearpath.com/mirror",#medspamarketing #aesthetics #medspaowner #aestheticpractice #beforeandafter #aesthetictech #injector #patientexperience #aestheticmedicine #medspa #aestheticclinic #medspalife #mirrorbyclearpath #selfcare #glowup,no
5,Fri,5:00 PM,Brand,brand-think-about-it.png,"“Let me think about it.”

It's rarely about your plan or your price, the patient just can't picture the result yet. Mirror lets them see it first, on your site, so “maybe” becomes “when can we start.” → aiclearpath.com/mirror",#medspamarketing #medspaowner #patientexperience #aesthetics #aestheticpractice #seeyourselfafter #aestheticbusiness #medspa #aestheticclinic #medspalife #aestheticmedicine #mirrorbyclearpath #selfcare #glowup,no
6,Sat,9:00 AM,Education,education-exit.png,"What a buyer checks first before they'll touch your medspa: clean books, 20%+ margins, repeat injectable revenue, and providers beyond the owner.

The gap between a 4× and an 8× exit is readiness, not revenue. → aiclearpath.com/mirror",#medspaowner #medspabusiness #privateequity #practicegrowth #medspamarketing #aestheticnurse #injector #aestheticeducation #botoxtips #medspa #aesthetics #aestheticclinic #medspalife #aestheticmedicine #mirrorbyclearpath,no
6,Sat,12:00 PM,BeforeAfter,ba2-06.png,"Half your market thinks aesthetics isn't “for them.” Men scroll past every before/after you post, because none of them is him. Put his own refreshed jawline in front of him and the math changes fast. (AI simulation, synthetic model.) The guys who see it book like everyone else. → aiclearpath.com/mirror",#medspamarketing #aesthetics #medspaowner #aestheticpractice #beforeandafter #aesthetictech #injector #patientexperience #aestheticmedicine #medspa #aestheticclinic #medspalife #mirrorbyclearpath #selfcare #glowup,no
6,Sat,5:00 PM,Trust,trust-not-guarantee.png,"We'll never call it a guarantee.

Mirror shows a realistic, conservatively-calibrated simulation to start the conversation, not a promise of a specific outcome. That honesty is exactly why patients trust it. → aiclearpath.com/mirror",#medspamarketing #patienttrust #aesthetics #aestheticpractice #medspaowner #dataprivacy #transparency #medspa #aestheticclinic #medspalife #aestheticmedicine #mirrorbyclearpath #selfcare #glowup,no
7,Sun,9:00 AM,Offer,offer-guarantee.png,"3 consults in 8 weeks, or it's free.

If Mirror doesn't help create at least 3 qualified consults in your first 8 weeks, you get a full refund. The risk is ours, not yours.

Try it → aiclearpath.com/mirror",#medspaowner #medspabusiness #medspamarketing #aestheticpractice #guarantee #practicegrowth #aestheticbusiness #medspa #aesthetics #aestheticclinic #medspalife #aestheticmedicine #mirrorbyclearpath #selfcare #glowup,no
7,Sun,12:00 PM,BeforeAfter,ba2-07.png,"The fear was never aging. It's looking “done.” That one worry kills more rejuvenation consults than price ever will. So answer it up front: a refreshed version that's unmistakably still her, shown before she commits. (AI simulation, synthetic model.) A nervous maybe becomes a yes. → aiclearpath.com/mirror",#medspamarketing #aesthetics #medspaowner #aestheticpractice #beforeandafter #aesthetictech #injector #patientexperience #aestheticmedicine #medspa #aestheticclinic #medspalife #mirrorbyclearpath #selfcare #glowup,no
7,Sun,5:00 PM,Magnet,magnet-atlas.png,"Free: The MedSpa Atlas.

The data behind 10,488 American medspas, revenue, growth, and pricing by state, in one interactive map.

Explore it (link in bio) → aiclearpath.com/mirror",#medspaowner #medspabusiness #medspamarketing #aestheticpractice #medspadata #freetool #aestheticbusiness #medspa #aesthetics #aestheticclinic #medspalife #aestheticmedicine #mirrorbyclearpath #selfcare #glowup,no
8,Mon,9:00 AM,Data,data-glp1.png,"GLP-1 weight-loss scripts are up 587% since 2019.

That's not a medspa stat yet, but it's about to be. As Ozempic reshapes faces, demand shifts toward filler and skin tightening. The clinics that win read demand early. → aiclearpath.com/mirror",#medspaowner #aesthetics #glp1 #medspamarketing #aestheticpractice #practicegrowth #aestheticbusiness #medspa #aestheticclinic #medspalife #aestheticmedicine #mirrorbyclearpath #selfcare #glowup,no
8,Mon,12:00 PM,BeforeAfter,ba2-08.png,"“I don't want to look overdone.” It's the number-one reason patients talk themselves out of filler. They can't tell a natural result from a duck until they see it on their own face. So show them, conservative and balanced, before they commit. (AI simulation, synthetic model.) Trust goes up, hesitation goes down. → aiclearpath.com/mirror",#medspamarketing #aesthetics #medspaowner #aestheticpractice #beforeandafter #aesthetictech #injector #patientexperience #aestheticmedicine #medspa #aestheticclinic #medspalife #mirrorbyclearpath #selfcare #glowup,no
8,Mon,5:00 PM,Product,product-embed.png,"One snippet. Any website.

Wix, WordPress, Squarespace, Shopify, Webflow, Mirror installs in ~24 hours and captures the lead at the moment of peak interest. → aiclearpath.com/mirror",#aesthetictech #medspamarketing #medspaowner #practicegrowth #webdesign #patientexperience #beautytech #medspa #aesthetics #aestheticclinic #medspalife #aestheticmedicine #mirrorbyclearpath #selfcare #glowup,no
9,Tue,9:00 AM,Brand,brand-derm-additive.png,"Mirror doesn't replace your VECTRA or Crisalix.

Those own the consult room, controlled capture, 3D volumetrics, clinical documentation. Mirror owns the website: it reaches the patient who hasn't booked yet. Additive, not a swap. → aiclearpath.com/mirror",#dermatology #cosmeticdermatology #aesthetictech #aestheticpractice #medspamarketing #seeyourselfafter #aestheticbusiness #medspa #aesthetics #aestheticclinic #medspalife #aestheticmedicine #mirrorbyclearpath #selfcare #glowup,no
9,Tue,12:00 PM,BeforeAfter,ba2-09.png,"A patient who can't picture “clearer skin” doesn't say no. She says “let me think about it,” then books where she can actually see it. That's a $400 visit out the door, and it happens a dozen times a month. Mirror shows her own result on your site in 30 seconds, before she clicks away. (AI simulation, synthetic model.) The ones who see it are the ones who book. → aiclearpath.com/mirror",#medspamarketing #aesthetics #medspaowner #aestheticpractice #beforeandafter #aesthetictech #injector #patientexperience #aestheticmedicine #medspa #aestheticclinic #medspalife #mirrorbyclearpath #selfcare #glowup,no
9,Tue,5:00 PM,Education,education-derm-realism.png,"“Can AI really show realistic skin results?”

Skin is the hardest thing to simulate, so we keep Mirror conservative on purpose and let you judge it on your own patients, across skin tones, in the live demo. Don't take our word for it. → aiclearpath.com/mirror",#dermatology #cosmeticdermatology #aesthetictech #skincare #aesthetics #aestheticnurse #injector #aestheticeducation #botoxtips #medspa #aestheticclinic #medspalife #aestheticmedicine #mirrorbyclearpath #selfcare,no
10,Wed,9:00 AM,Trust,trust-no-phi.png,"No records. No PHI.

Mirror collects no diagnosis or treatment data, so it sits outside HIPAA's scope entirely, a privacy-first workflow by design.

The details: aiclearpath.com/privacy",#dataprivacy #medspamarketing #patienttrust #aestheticpractice #healthtech #transparency #medspa #aesthetics #aestheticclinic #medspalife #aestheticmedicine #mirrorbyclearpath #selfcare #glowup,no
10,Wed,12:00 PM,BeforeAfter,ba2-10.png,"A patient who can't picture “clearer skin” doesn't say no. She says “let me think about it,” then books where she can actually see it. That's a $400 visit out the door, and it happens a dozen times a month. Mirror shows her own result on your site in 30 seconds, before she clicks away. (AI simulation, synthetic model.) The ones who see it are the ones who book. → aiclearpath.com/mirror",#medspamarketing #aesthetics #medspaowner #aestheticpractice #beforeandafter #aesthetictech #injector #patientexperience #aestheticmedicine #medspa #aestheticclinic #medspalife #mirrorbyclearpath #selfcare #glowup,no
10,Wed,5:00 PM,Offer,offer-two-ways.png,"Two ways in: $347/mo, or $2,497 once.

Monthly and cancel anytime, or pay once, own it for life, with a 30-day money-back guarantee. Your call.

See pricing → aiclearpath.com/mirror",#medspaowner #medspabusiness #medspamarketing #pricing #aestheticpractice #practicegrowth #aestheticbusiness #medspa #aesthetics #aestheticclinic #medspalife #aestheticmedicine #mirrorbyclearpath #selfcare #glowup,no
11,Thu,9:00 AM,Magnet,magnet-teardown.png,"Free tool: The 3-Leak Teardown.

Six inputs. Get back the #1 thing leaking patients out of your booking flow, plus a 3-step fix. Takes two minutes.

Run yours (link in bio) → aiclearpath.com/mirror",#medspamarketing #medspaowner #conversionoptimization #aestheticpractice #practicegrowth #freetool #aestheticbusiness #medspa #aesthetics #aestheticclinic #medspalife #aestheticmedicine #mirrorbyclearpath #selfcare #glowup,no
11,Thu,12:00 PM,BeforeAfter,ba2-11.png,"Fastest way to lose a Botox booking? Ask the patient to imagine the result. They can't, so they “think about it,” and that consult is gone. Mirror hands them their own softened forehead on your website, before the needle. (AI simulation, synthetic model.) Picture it, then book it. → aiclearpath.com/mirror",#medspamarketing #aesthetics #medspaowner #aestheticpractice #beforeandafter #aesthetictech #injector #patientexperience #aestheticmedicine #medspa #aestheticclinic #medspalife #mirrorbyclearpath #selfcare #glowup,no
11,Thu,5:00 PM,Data,data-botox-spread.png,"The same unit of Botox costs $252 in Wyoming and $536 in Wisconsin.

Same syringe, same vial cost, 2.1× the price, set by geography. Most owners price off their costs. The data says your ZIP code is the real lever. → aiclearpath.com/mirror",#medspaowner #botox #medspamarketing #medspabusiness #aestheticpractice #practicegrowth #aestheticbusiness #medspa #aesthetics #aestheticclinic #medspalife #aestheticmedicine #mirrorbyclearpath #selfcare #glowup,no
12,Fri,9:00 AM,Product,product-leadcapture.png,"The moment a patient sees their result is the moment they're most likely to book.

Mirror captures the email right there, at peak interest, not after they've left. → aiclearpath.com/mirror",#aesthetictech #medspamarketing #medspaowner #leadgeneration #patientexperience #beautytech #medspa #aesthetics #aestheticclinic #medspalife #aestheticmedicine #mirrorbyclearpath #selfcare #glowup,no
12,Fri,12:00 PM,BeforeAfter,ba2-12.png,"A patient who can't picture “clearer skin” doesn't say no. She says “let me think about it,” then books where she can actually see it. That's a $400 visit out the door, and it happens a dozen times a month. Mirror shows her own result on your site in 30 seconds, before she clicks away. (AI simulation, synthetic model.) The ones who see it are the ones who book. → aiclearpath.com/mirror",#medspamarketing #aesthetics #medspaowner #aestheticpractice #beforeandafter #aesthetictech #injector #patientexperience #aestheticmedicine #medspa #aestheticclinic #medspalife #mirrorbyclearpath #selfcare #glowup,no
12,Fri,5:00 PM,Brand,brand-why.png,"Patients can't picture it on their own face.

So they say “let me think about it”, and book elsewhere. We built Mirror so they can see it first, on your site. That's the whole idea. → aiclearpath.com/mirror",#medspamarketing #medspaowner #aesthetics #patientexperience #aestheticpractice #seeyourselfafter #aestheticbusiness #medspa #aestheticclinic #medspalife #aestheticmedicine #mirrorbyclearpath #selfcare #glowup,no
13,Sat,9:00 AM,Education,dosage-botox.png,"More units isn't the goal, the right dose is.

Botox softens lines in ~2 weeks and lasts 3–4 months. The art is in how much, and where. Mirror helps patients picture the difference between a refresh and overdone.

Save this for your next consult.",#botox #aestheticnurse #injector #medspa #aestheticeducation #botoxtips #aesthetics #aestheticclinic #medspalife #aestheticmedicine #mirrorbyclearpath #selfcare #glowup,no
13,Sat,12:00 PM,BeforeAfter,ba2-13.png,"“You look tired” is the most common thing your patients hear, and the treatment they're most likely to put off. The reason is simple: they can't picture the rested version of their own face. So show them before the consult, not after. (AI simulation, synthetic model.) “Maybe someday” turns into a booking this week. → aiclearpath.com/mirror",#medspamarketing #aesthetics #medspaowner #aestheticpractice #beforeandafter #aesthetictech #injector #patientexperience #aestheticmedicine #medspa #aestheticclinic #medspalife #mirrorbyclearpath #selfcare #glowup,no
13,Sat,5:00 PM,Trust,trust-calibrated.png,"We tuned Mirror to under-promise.

We'd rather a patient be pleasantly surprised in the chair than let down. The previews lean conservative on purpose, because trust is the product. → aiclearpath.com/mirror",#medspamarketing #patienttrust #aesthetics #aestheticpractice #medspaowner #dataprivacy #transparency #medspa #aestheticclinic #medspalife #aestheticmedicine #mirrorbyclearpath #selfcare #glowup,no
14,Sun,9:00 AM,Offer,offer-trial.png,"Try Mirror free for 14 days.

Full access, no setup fee. Keep it only if it's filling your consult calendar, then it's $347/mo. The risk is ours. → aiclearpath.com/mirror",#medspaowner #medspabusiness #medspamarketing #aestheticpractice #freetrial #practicegrowth #aestheticbusiness #medspa #aesthetics #aestheticclinic #medspalife #aestheticmedicine #mirrorbyclearpath #selfcare #glowup,no
14,Sun,12:00 PM,BeforeAfter,ba2-14.png,"“I don't want to look overdone.” It's the number-one reason patients talk themselves out of filler. They can't tell a natural result from a duck until they see it on their own face. So show them, conservative and balanced, before they commit. (AI simulation, synthetic model.) Trust goes up, hesitation goes down. → aiclearpath.com/mirror",#medspamarketing #aesthetics #medspaowner #aestheticpractice #beforeandafter #aesthetictech #injector #patientexperience #aestheticmedicine #medspa #aestheticclinic #medspalife #mirrorbyclearpath #selfcare #glowup,no
14,Sun,5:00 PM,Magnet,magnet-rankings.png,"Free tool: MedSpa Power Rankings.

See how your practice stacks up in your city, visibility, reviews, conversion. Know where you actually stand.

Check your rank (link in bio) → aiclearpath.com/mirror",#medspamarketing #medspaowner #localseo #aestheticpractice #practicegrowth #freetool #aestheticbusiness #medspa #aesthetics #aestheticclinic #medspalife #aestheticmedicine #mirrorbyclearpath #selfcare #glowup,no
15,Mon,9:00 AM,Data,data-pe-multiple.png,"Medspa asking multiples jumped from ~5× to ~8× EBITDA in 18 months.

KKR, TPG and Ares have all entered the space. If you've ever wondered what your practice is worth to a buyer, it's more than it was a year ago. → aiclearpath.com/mirror",#medspaowner #medspabusiness #privateequity #practicegrowth #medspamarketing #aestheticbusiness #medspa #aesthetics #aestheticclinic #medspalife #aestheticmedicine #mirrorbyclearpath #selfcare #glowup,no
15,Mon,12:00 PM,BeforeAfter,ba2-15.png,"Almost 1 in 6 adults calls their own smile “ugly.” They will never say that to you. They just research quietly, hesitate, and book nothing. Here's what flips it: letting them see their brighter smile before the chair. (AI simulation, synthetic model.) → aiclearpath.com/mirror",#medspamarketing #aesthetics #medspaowner #aestheticpractice #beforeandafter #aesthetictech #injector #patientexperience #aestheticmedicine #medspa #aestheticclinic #medspalife #mirrorbyclearpath #selfcare #glowup,no
15,Mon,5:00 PM,Product,product-247.png,"Your consult, running 24/7.

Mirror works while you sleep, every late-night visitor to your site gets a personalized preview and a reason to book. → aiclearpath.com/mirror",#aesthetictech #medspamarketing #medspaowner #practicegrowth #aesthetics #patientexperience #beautytech #medspa #aestheticclinic #medspalife #aestheticmedicine #mirrorbyclearpath #selfcare #glowup,no
16,Tue,9:00 AM,Brand,brand-thesis.png,"The aesthetic decision is visual. So we made it visual.

Patients choose with their eyes, Mirror simply lets them look before they book, on your own website. → aiclearpath.com/mirror",#medspamarketing #aesthetics #medspaowner #aestheticpractice #aesthetictech #seeyourselfafter #aestheticbusiness #medspa #aestheticclinic #medspalife #aestheticmedicine #mirrorbyclearpath #selfcare #glowup,no
16,Tue,12:00 PM,BeforeAfter,ba2-16.png,"A patient who can't picture “clearer skin” doesn't say no. She says “let me think about it,” then books where she can actually see it. That's a $400 visit out the door, and it happens a dozen times a month. Mirror shows her own result on your site in 30 seconds, before she clicks away. (AI simulation, synthetic model.) The ones who see it are the ones who book. → aiclearpath.com/mirror",#medspamarketing #aesthetics #medspaowner #aestheticpractice #beforeandafter #aesthetictech #injector #patientexperience #aestheticmedicine #medspa #aestheticclinic #medspalife #mirrorbyclearpath #selfcare #glowup,no
16,Tue,5:00 PM,Education,dosage-filler.png,"What does 1cc of filler actually move? About a third of a teaspoon.

Placed well it restores; overdone it distorts. The plan should be visible before the needle, that's the whole point of seeing it first.

Save this.",#dermalfiller #injector #aestheticnurse #medspa #aestheticeducation #botoxtips #aesthetics #aestheticclinic #medspalife #aestheticmedicine #mirrorbyclearpath #selfcare #glowup,no
17,Wed,9:00 AM,Magnet,magnet-wizard.png,"Free tool: the Install Wizard.

Answer a few questions, get the exact embed snippet for your site, Wix, WordPress, Squarespace, anything. Live in a day.

Get your snippet (link in bio) → aiclearpath.com/mirror",#medspamarketing #medspaowner #aesthetictech #webdesign #aestheticpractice #freetool #aestheticbusiness #medspa #aesthetics #aestheticclinic #medspalife #aestheticmedicine #mirrorbyclearpath #selfcare #glowup,no
17,Wed,12:00 PM,BeforeAfter,ba2-17.png,"Half your market thinks aesthetics isn't “for them.” Men scroll past every before/after you post, because none of them is him. Put his own refreshed jawline in front of him and the math changes fast. (AI simulation, synthetic model.) The guys who see it book like everyone else. → aiclearpath.com/mirror",#medspamarketing #aesthetics #medspaowner #aestheticpractice #beforeandafter #aesthetictech #injector #patientexperience #aestheticmedicine #medspa #aestheticclinic #medspalife #mirrorbyclearpath #selfcare #glowup,no
